title,url,post_id,author,time,comments,likes,excerpt,preview_url
🚀New Video: How I'd Make Money with AI in 2026 (if I had to Start Over),https://www.skool.com/ai-automation-society/new-video-how-id-make-money-with-ai-in-2026-if-i-had-to-start-over,516f0bbb,Nate Herk,2d •,214,203,"In this video I'm going to be teaching you how I'd make money with AI in 2026, if I had to start over from scratch.  This will be the most actionable video you've ever seen about making money with AI. I'll breakdown everything, and fitting it all into this easy to learn 24 minute guide. Hope you enjoy!",https://i.ytimg.com/vi/Q46OLxFshAQ/hqdefault.jpg
PRICE INCREASE coming Monday (important),https://www.skool.com/ai-automation-society/price-increase-coming-monday-important,4309dcd2,Nate Herk,3d •,110,113,"Heads up, on Monday at midnight, the price of AI Automation Society Plus is increasing.  The good news?  If you join before then, you’ll lock in the current $89/month rate forever.  Here’s what you’ll get immediate access to: ⚡ Agent Zero — a crash course for absolute beginners where you learn the basics in a simple, step-by-step format ⚡ 10 Hours to 10 Minutes — how to decide what to automate so you save yourself (and others) massive amounts of time ⚡ Unlimited tech support — working on automation and get stuck? Our team will jump in and give you advice on how to fix the problem ⚡1 Live Q&A with me per Week — get all of your agency questions answered, and all of these are recorded!  Plus, you’ll be eligible for our $6,000 in monthly cash prizes.  Every month, we hold a competition to see who can build the coolest automation, and we give a prize to both experts and beginners (based on who is learning the fastest).  And if you go annual?  You’ll unlock our premium training: The One Person AI Agency — the exact blueprint to build a lean, high-profit automation business. This alone is worth $1,000.  Bottom line: → You get instant access to everything above… → And your price is locked in forever. Others will pay more while your price never increases.  👉 Click here to lock in your price   I’ll see you inside.  Nate",
🚀Build ANYTHING with Claude Sonnet 4.5 and n8n AI Agents,https://www.skool.com/ai-automation-society/build-anything-with-claude-sonnet-45-and-n8n-ai-agents,1cfc004c,Nate Herk,3d •,92,176,"In this video, I break down Anthropic’s new Claude Sonnet 4.5 model and walk through what’s new in the release. I cover its strengths, weaknesses, and how it stacks up for real-world use.  Then, I show you step-by-step how to quickly connect an AI agent to Sonnet 4.5 and put it to the test. We run three experiments: first, content creation compared against other models; second, a context window evaluation to see how well it handles questions; and third, connecting it to multiple tools to act as an ultimate assistant.  If you’ve been curious about this new model and how it could change the game for automation, this video will give you a clear look at what it can really do.",https://i.ytimg.com/vi/X80ljdCPM_U/hqdefault.jpg
OCR Vendor Bankruptcy at 3 AM - Emergency Rescue Mission,https://www.skool.com/ai-automation-society/ocr-vendor-bankruptcy-at-3-am-emergency-rescue-mission,5918227f,Duy Bui,9h •,4,8,"Emergency call: ""Our OCR provider shut down. 12,000 insurance forms due by 8 AM. We're dead.""  Medical billing company. Forms worth $2.4M in insurance claims. No backup plan.  THE DISASTER SCOPE - Primary OCR vendor: Bankrupt overnight - Backup system: Doesn't exist - Manual processing time: 16 hours minimum - Insurance deadline: 5 hours away - Forms completed: 0 of 12,000  4 AM DESPERATION BUILD Every OCR service tested failed on their complex medical forms. Built emergency hybrid system:  THE EMERGENCY n8n WORKFLOW (19 nodes) Zone-based processing approach:  Header processing (Nodes 1-3): - Patient info extraction via pattern matching - Insurance ID number recognition - Date field validation  Form sections (Nodes 4-8): - Checkbox detection and binary reading - Printed text via enhanced OCR - Handwritten sections via AI processing - Table structure preservation - Signature area validation  Quality control (Nodes 9-12): - Confidence scoring per zone - Cross-field validation - Error flagging and correction - Manual review queue  Output generation (Nodes 13-19): - Insurance format compilation - Batch processing and validation - Direct submission to insurance APIs - Confirmation tracking - Error reporting  THE MORNING MIRACLE 6:30 AM: Emergency system operational 7:00 AM: Processing 400 forms/hour 7:45 AM: 11,200 forms submitted successfully 8:00 AM: Final 800 forms completed Total processed: 12,000 forms in 90 minutes  Accuracy: 94.8% (acceptable for emergency submission) Insurance acceptance rate: 97.2%  CEO reaction: Tears of relief. Literally.  CRISIS BECOMES OPPORTUNITY Emergency solution worked so well: - Signed 3-year exclusive contract: $6,800/month - Eliminated dependency on external OCR vendors - Referred me to 6 other medical billing companies  Current medical emergency processing revenue: $22,400/month across 5 companies  THE VENDOR INDEPENDENCE STRATEGY Built redundant processing capabilities: - Primary: Enhanced parsing for complex documents - Backup 1: Standard OCR for clean documents",
The Hidden Reason Most AI Projects Fail (And It’s Not the Tech),https://www.skool.com/ai-automation-society/the-hidden-reason-most-ai-projects-fail-and-its-not-the-tech,c581aaee,Lê Lan Chi,18m •,1,3,"Here’s what most people miss:AI projects don’t fail because the model wasn’t good enough.They fail because no one redesigned the human workflow around it. Everyone rushes to “add AI” — automate a task, plug in a model, connect a few tools — but they forget the invisible layer:How humans interact with that new system. When you automate without redesigning the workflow, people stop trusting the process.They second-guess the AI.They create manual backups “just in case.”And ironically, the system becomes slower than before. Real AI transformation isn’t “replace humans with automation.”It’s rebuilding how humans, data, and decisions flow together — so that automation feels natural, not forced.",
Welcome! Introduce yourself + share a career goal you have 🎉,https://www.skool.com/ai-automation-society/welcome-introduce-yourself-share-a-career-goal-you-have,36f88df6,Nate Herk,Oct '24 •,7,1,"Let's get to know each other! Comment below sharing where you are in the world, a career goal you have, and something you like to do for fun. 😊",
Website 1 #,https://www.skool.com/ai-automation-society/website-1,d7e32144,Muskan Ahlawat,3d •,23,11,I build a website from lovable. Don't know how it is ? I want to separate it from lovable?? https://timbre-craft-studio.lovable.app,
For Hire - Get a $3500 Al Voice Calling Agent — FREE!,https://www.skool.com/ai-automation-society/for-hire-get-a-3500-al-voice-calling-agent-free-3,a02be11e,Dumale Lokesh,34m •,1,1,"Imagine having an assistant that makes hundreds of calls daily, never tires, and helps you close deals while you focus on growing your business. That's exactly what I'm offering - a FREE Al voice calling agent, tailored to your needs and proven to get real results. In fact, my clients in the real estate industry closed 43 deals in the first week using this Al agent. Now, I'm offering the same powerful tool to you, completely free, with No Upfront Charges. Here's What You'll Get for FREE: Automated Outbound Calls: The Al agent will make calls for you, ensuring every prospect is reached with a clear, professional message. # Lead Capture & Qualification: Collect key lead info like names, emails, and interests - all organized in your CRM for easy follow-up. So Instant Appointment Scheduling: The Al can schedule meetings on the spot, syncing with tools like Calendly to make it seamless for your prospects. a Real-Time Conversations: It's smart enough to answer questions, handle objections, and adjust",
Build 22 #,https://www.skool.com/ai-automation-society/build-22,b300217f,Muskan Ahlawat,16h •,7,7,"🔥 Candidate profiles are often incomplete—missing skills, summaries, or context recruiters need.  So I built a workflow that: 1️⃣ Captures a candidate’s LinkedIn URL 2️⃣ Fetches detailed profile data via Proxycurl API 3️⃣ Uses AI to summarize + extract key skills 4️⃣ Saves everything in Google Sheets 5️⃣ Instantly emails the recruiter with the enriched profile  ⚡ End result: recruiters get richer profiles instantly, no manual digging needed.  Would you trust AI-generated skill insights alongside LinkedIn data?",
Something HUGE just clicked for me,https://www.skool.com/ai-automation-society/something-huge-just-clicked-for-me,a316ef57,Aaron G,5h •,2,4,"Who else has experienced this:  After a long day of working on an agent, something inexplicable happened. All of a sudden, something clicked, and I realized the way I was designing workflows was incredibly inefficient. As if a wave of wisdom just washed through my brain, my workflows immediately went from (1)👇 to (2) 👇 - why go overkill with an agent when I can just message a model - why force feed the LLM every piece of information, when you can give it a tool to cherry-pick only the information it needs - And for godsake, why all the merging, aggregating and messy lines, when you can stringify json objects for the ai nodes...  I feel so clear-headed. I was introduced to 'make' about 2 months ago. Making simple automations for my own business. Now after consuming enormous amounts of youtube, podcasts, and long nights of experimenting with these platforms, I feel I am able to actually provide value to businesses. Efficiently & effectively.  Can anyone else recall the feeling when their workflows went from 1 ->2?",
For Hire - Get a $3500 Al Voice Calling Agent — FREE!,https://www.skool.com/ai-automation-society/for-hire-get-a-3500-al-voice-calling-agent-free-2,b08a114b,Dumale Lokesh,36m •,2,2,"Imagine having an assistant that makes hundreds of calls daily, never tires, and helps you close deals while you focus on growing your business. That's exactly what I'm offering - a FREE Al voice calling agent, tailored to your needs and proven to get real results. In fact, my clients in the real estate industry closed 43 deals in the first week using this Al agent. Now, I'm offering the same powerful tool to you, completely free, with No Upfront Charges. Here's What You'll Get for FREE: Automated Outbound Calls: The Al agent will make calls for you, ensuring every prospect is reached with a clear, professional message. # Lead Capture & Qualification: Collect key lead info like names, emails, and interests - all organized in your CRM for easy follow-up. So Instant Appointment Scheduling: The Al can schedule meetings on the spot, syncing with tools like Calendly to make it seamless for your prospects. a Real-Time Conversations: It's smart enough to answer questions, handle objections, and adiust",
Question,https://www.skool.com/ai-automation-society/question-e7154527,,Shane Mathew,42m •,0,1,"How do I modify an n8n workflow template that books appointments to one Google Calendar so it works for a dental clinic with 6 staff members (3 dentists, 3 hygienists), each with their own calendar, automatically routing patients to the right provider based on treatment type?",
"🧐 Turn PDFs into Clean, LLM-Ready Data",https://www.skool.com/ai-automation-society/turn-pdfs-into-clean-llm-ready-data,a6d0dc0b,Mišel Čupković,Aug 11 •,12,14,"PDFs lock content into complex layouts, making it difficult for LLMs to process text, tables, and images effectively.  Dolphin is an open source parsing framework that converts PDFs into structured formats such as Markdown, HTML, LaTeX, and JSON.  🛠️ How It Works 1. Layout analysis - Detects and sequences elements according to the document’s natural reading order. 2. Parallel parsing - Processes each element with specialized prompts tailored to different content types (text blocks, tables, figures, etc.).  🗝️ Key Features - Two-stage “analyze-then-parse” pipeline powered by a single VLM - Strong performance on complex document parsing tasks - Reading-order-aware element sequencing - Specialized prompts for different document elements - Efficient parallel parsing for faster results  It’s 100% Open Source 🙌🏻  Github Repo",
Handwritted PDF --> Excel,https://www.skool.com/ai-automation-society/handwritted-pdf-excel,80ed5bed,Heather Signorelli,23h •,18,10,"Hi all, I have tried Llama Cloud and a few other options to try and take a very messy PDF with a mix of typed and hand written words to an excel spreadsheet. These are patient manifests from a hospital with doctor handwriting on them (you can imagine what I am getting) and just can't for the life of me figure out a way to teach these tools to capture the right information. Does anyone have experience with this? I have searched the past posts but I have tried those tools and I feel like how unstructured it is is a mess. Thank you!!",
This is how to sell your automations.,https://www.skool.com/ai-automation-society/how-to-actually-sell-your-automations,1d0abda5,Titus Blair,5d •,55,30,"@Ankush Dev recently asked the following and here are my answers, hope this helps!!  - How do I actually sell these automations? You need to know the problem you are solving and how big a problem it is, how much would people pay realistically to solve it. if they would pay as much as you charged for it you have a great solution, go for those!  - How should I structure and position my offers? If you solve a big enough problem you dont need to structure or position it at all it will sell itself. The HARDEST part is finding that problem!  - What’s the best way to deliver an AI agent or automation to a client once it’s ready? Create a N8N HOSTED account for them, maanged and run by N8N. Tell them the monthly charge + any markup or additional support/maintenance fees as a monthly subscription use the N8N levels of costs to calc overages or plan upgrades when needed.  - When it comes to ongoing usage, who usually covers the API costs — me or the client? You cover it all and bill them 1 subscription, It's important to set out usage caps and what happens if those caps are reached, new tier of subscription, overage charges etc. Make sure to WARN them well in advanced of hitting and caps/limits.  - Should I price based on one-time setup, monthly retainers, or usage-based billing? Monthly + Setup, most people understand this and you can work on the setup fee to sign a customer.  - How do you handle clients who don’t understand technical costs like APIs or hosting? They don't have to its a subscription that solves their biggest pain and allows them to grow and be stress free, its emotions!  - What’s the most beginner-friendly way to package and deliver these solutions (so the client doesn’t need to touch code)? You setup a N8N account for this client, you manage the workflows, etc they just pay the subscription + support + dev + maintenance etc fees.  Rem this is going to be done ENTIRELY by AI in the next 12-24 months so hustle!",
"I just got paid by my first client. It’s not a lot, just $80, but it’s a start.",https://www.skool.com/ai-automation-society/i-just-got-paid-by-my-first-client-its-not-a-lot-just-80-but-its-a-start,d10fe9b8,Chris Jadama,24h •,7,4,"A few things I messed up with this client:  - I agreed to ongoing support, but we never set clear terms. - We’re currently using my OpenAI account, Render account, and Railway account.  Lesson learned: for the next job, once the work is done, I need to clearly define the handover process and set a small retainer fee for support.  Another thing I realized is that I’m the bottleneck when it comes to getting more jobs. The better and faster I get, the more work I can handle.",
How I Made the n8n Workflow Simple with the 1 Code: Here's How,https://www.skool.com/ai-automation-society/how-i-made-the-n8n-workflow-simple-with-the-1-code-heres-how,a066638a,Hasnain Nisar,4h •,2,3,"A client reached out to me to automate a horse schedule sheet for 40+ horses. Every morning at 8 AM, they needed to track which services each horse would receive that day (e.g., Thursday services), update the sheet with the service details, and note the date.  The real kicker? At the end of the month, the client has to generate invoices, so they need to know exactly which horse received which service and how many times that month. This was becoming a huge manual task—checking the schedule, updating records, and creating invoices.  Initially, I used the Google Sheets part, with minor adjustments, and reused it repeatedly, which made the workflow more complex and harder for the client to understand.  So, I asked myself: 'How can I make this more efficient and simpler for the client, who might get stuck when making changes to such a complex workflow?  My Solution, I created custom code that takes information from the previous node, which changes every time (like the day names). Because the data changes, I used a switch condition. The same Google Sheets part, with minor adjustments, was being reused repeatedly, making the workflow more complex and larger. So, I wrote the code to fetch the name and pass the required information, allowing me to use the Google Sheets part just once. This simplifies the process, making it easier for the client to understand and make changes.  💬 Your Thoughts? If anyone has a different approach to solving this type of challenge or any tips for optimizing workflows with n8n and Google Sheets, feel free to share in the comments! Let’s collaborate and help each other out. 🙌  Also, let’s see if this project leads to another exciting opportunity to work on an invoicing workflow for the client. Fingers crossed! 🤞  #Automation #n8n #GoogleSheets #WorkflowAutomation #Fiverr #TechSolutions #HorseSchedule #Invoicing #Productivity #SoftwareDevelopment",
New to this community !,https://www.skool.com/ai-automation-society/new-to-this-community,2162f88a,Rishi Raj,3d •,30,16,Its been just a week since I Joined this community and what can i say. I have received more support from here than ever from LinkedIn. Keep up the hustle guys! Looking forward to connect with everyone :),
Share your WEEKLY ACHIEVEMENTS!!,https://www.skool.com/ai-automation-society/share-your-weekly-achievements,67639bad,Rishi Raj,18h •,44,12,"Hey fellow members.  I think regularly sharing our achievements, new things we learned, our goals would be a great way to keep our community active and get the best out of it.  I have finished the foundational concepts od n8n. Now I am planning to strengthen the concepts in AI, Prompting, RAG, and other concepts. I have recreated 10 workflows through YT tutorials.  Feel free to share you achievements in the comment section :) ⬇️⬇️⬇️",
September MVPs Are Here! 🏆,https://www.skool.com/ai-automation-society/september-mvps-are-here,f217fab0,Nate Herk,3d •,271,128,"Huge shoutout to the Top 5 Members of AI Automation Society for September!  These are the people leading the way, sharing knowledge, and helping spread the AIS culture: 1️⃣ @Titus Blair – Absolutely dominating this month with incredible contributions! 🔥 2️⃣ @Muskan Ahlawat 3️⃣ @Frank van Bokhorst 4️⃣ @Christian Rivadeneira 5️⃣ @Duy Bui  And a special mention to @Tatyana Gray Etkin , who landed in 6th place and just missed the Top 5.  We’re rooting for you to break through next month! 👏  Keep contributing, sharing wins, and helping others grow! Our community gets better because of you.  Let’s keep building, keep learning, and keep spreading that AIS energy. 🚀  Cheers, Nate",
💡Keep Going The Journey Just Started!,https://www.skool.com/ai-automation-society/keep-going-the-journey-just-started,,Emily Chloe,4h •,0,3,"Hey everyone 👋  I know the beginning of this AI automation journey can feel tough sometimes full of challenges, confusion, and doubts. But remember, every expert you see today once started right where we are now.  Let’s keep following the admin’s advice and applying what we learn step by step. Even if progress feels slow, small progress is still progress! 💥  With consistency, patience, and teamwork, things will start changing little by little. I believe we’ll all grow, learn, and succeed together in this community. 🙌  Let’s stay motivated, keep showing up, and support one another our success is loading! 🚀  Thank you all ❤️",
🚀 Limited-Time Offer: Get Your Dream Website at 29% OFF!,https://www.skool.com/ai-automation-society/limited-time-offer-get-your-dream-website-at-29-off,,Nitin Nn,4h •,0,4,"Hey there! 👋 If you’re looking to build a website for your agency, business, or personal brand, this is the perfect time.  I’m offering an exclusive 29% discount — and the best part? 💨Your website will be delivered in days, not weeks!  I’ve recently completed some amazing projects that you can check out in the video and images below. If you’re ready to grow your online presence with a clean, modern, and fast-performing website —let’s make it happen! 💻🔥  👉 DM me now to grab this offer before it’s gone!",
From Newbie to Next-Level: Stay Focused and Keep Growing!,https://www.skool.com/ai-automation-society/from-newbie-to-next-level-stay-focused-and-keep-growing,6493817c,Emily Chloe,1d •,18,17,"🔥 Stay Focused, Stay Consistent 🔥  Hey everyone! I’m excited to be here as a newbie in this amazing AI Automation Society community 🚀.  I just want to remind us all especially those who are just starting out like me that success in this journey doesn’t come overnight. It comes from showing up every day, staying consistent, and taking small steps forward.  Don’t compare your beginning to someone else’s middle. Every expert here was once a beginner too. What matters is that we stay focused, keep learning, and support one another.  Together, we can achieve amazing things in this space. Let’s keep pushing, keep growing, and never lose sight of why we started! 💪✨",
🤖Email Agent -AI Powered Email Automation Tool,https://www.skool.com/ai-automation-society/email-agent-ai-powered-email-automation-tool,db730403,Muzzamil Ansari,18h •,9,12,"💥I can build email agents that automate replies, organize your inbox, and boost productivity. Perfect for businesses looking to save time and never miss an important email💥  📌AI Email Agent for Job Advertising and Task AssignmentI developed an automated email agent designed communication. It autonomously sends job advertisements to candidates and assigns tasks to employees based on predefined logic or input data. 😎This agent helps reduce manual effort in recruitment outreach and internal task distribution, ensuring timely and consistent communication across teams.",
Construction industry team work ... R u interested?,https://www.skool.com/ai-automation-society/construction-industry-team-work-r-u-interested,3cec1584,Eva Chong,8h •,1,4,"Let do it... Construction workflows Hello from Malaysia, I am looking for team work to work out construction workflow. Who is interested? Please dm me ... Thanks",
bug issue ⚠️ (help!),https://www.skool.com/ai-automation-society/bug-issue-help,99b9ffc7,Rabin Abdullah,13h •,3,3,"so , i was building customer feedback automation. my workflow was - form ➡️ ai agent➡️ merge➡️switch node➡️ google sheets➡️slack➡️gmail but i am facing issue for (/n) . for this issue the switch node isn’t working. ( i have also putted a function node to solve (/n) but still the switch node isn’t working  anyone know about this pls do suggest me!!!",
🚀 New Video: The TRUTH About Selling AI Automations to Businesses,https://www.skool.com/ai-automation-society/new-video-why-no-one-is-buying-your-ai-agents-and-how-to-fix-it,21a9db57,Nate Herk,21d •,131,189,"In this video I'll be telling you guys, why no one is buying your ai agents, and exactly how to fix it. And I know this works, because I used this exact method to fix my fix my own business. So grab a pen and paper, and take some notes. Hope you enjoy!",https://i.ytimg.com/vi/SAerRtQLD0I/hqdefault.jpg
🚀 Build Another Basic Project Using the New n8n Data Tables!,https://www.skool.com/ai-automation-society/build-another-basic-project-using-the-new-n8n-data-tables,9c891651,Sameer Uddin,7h •,4,5,"Hey everyone 👋  Just wrapped up a beginner-friendly automation using the new n8n Data Tables feature, and it’s honestly a game changer for organizing and tracking info directly inside n8n! Here’s what I built 👇 🧩 Project: Simple Lead Tracker ⚙️ Features: - Automatically captures new leads from a form/webhook - Stores them neatly in an n8n Data Table - Has a Status column that updates as leads move from New → Contacted → Converted - Can even trigger automations based on the status (like sending follow-ups or Slack alerts).  The new Data Tables made this super smooth — no external database, just native inside n8n. 🔥 I’m planning to expand it next with:  - Auto-email replies when status changes - A mini dashboard for visualizing lead progress  If anyone wants the workflow JSON or a mini walkthrough, I can share it here too 🙌",
